{
  "rate_card_presentment_contract_version": 1,
  "rate_card_id": "019d7b92-1aa0-7a7f-b61c-962c0f4bf672",
  "tenant_reference": "urn:cwl:tenant_001",
  "rate_card_name": "workflow_premium",
  "currency_code": "USD",
  "rate_card_version": 1,
  "rate_card_version_id": "019d7b92-1aa0-7a7f-b61c-962c0f4bf673",
  "created_at": "2026-08-17T22:00:00Z",
  "published_at": "2026-08-17T22:00:00Z",
  "next_operator_action": "rate_window",
  "lines": [
    {
      "metric_code": "gen_ai_output_token",
      "unit_amount": "0.000005",
      "currency_code": "USD"
    }
  ]
}
